{
  "schemaVersion": 1,
  "repository": "example-owner/example-repository",
  "canonicalDocs": [
    {
      "path": "CONTEXT.md",
      "role": "context-language",
      "owner": "domain-owner"
    },
    {
      "path": "docs/top-level-knowledge",
      "role": "top-level-knowledge",
      "owner": "product-architecture-owner"
    },
    {
      "path": "docs/module-knowledge",
      "role": "module-spec",
      "owner": "module-owners",
      "moduleInventory": true
    }
  ],
  "pendingPath": "docs/module-knowledge/_pending.md",
  "compactionPath": "docs/module-knowledge/_compaction",
  "statePath": "docs/module-knowledge/_compaction/state.json",
  "implementationsPath": "docs/implementations",
  "excludePaths": [
    "docs/implementations/fixtures"
  ],
  "dangerRules": [
    {
      "id": "retired-current-contract",
      "description": "Retired concepts must not remain phrased as current top-level contracts.",
      "literals": [
        "historical read-only contract"
      ],
      "paths": [
        "CONTEXT.md",
        "docs/top-level-knowledge"
      ]
    }
  ]
}
